"Product Name","Price","Rating"
"sunt aut facere repellat provident occaecati excepturi optio reprehenderit","N/A","No rating"
"qui est esse","N/A","No rating"
"ea molestias quasi exercitationem repellat qui ipsa sit aut","N/A","No rating"
"eum et est occaecati","N/A","No rating"
"nesciunt quas odio","N/A","No rating"
"dolorem eum magni eos aperiam quia","N/A","No rating"
"magnam facilis autem","N/A","No rating"
"dolorem dolore est ipsam","N/A","No rating"
"nesciunt iure omnis dolorem tempora et accusantium","N/A","No rating"
"optio molestias id quia eum","N/A","No rating"
"et ea vero quia laudantium autem","N/A","No rating"
"in quibusdam tempore odit est dolorem","N/A","No rating"
"dolorum ut in voluptas mollitia et saepe quo animi","N/A","No rating"
"voluptatem eligendi optio","N/A","No rating"
"eveniet quod temporibus","N/A","No rating"
"sint suscipit perspiciatis velit dolorum rerum ipsa laboriosam odio","N/A","No rating"
"fugit voluptas sed molestias voluptatem provident","N/A","No rating"
"voluptate et itaque vero tempora molestiae","N/A","No rating"
"adipisci placeat illum aut reiciendis qui","N/A","No rating"
"doloribus ad provident suscipit at","N/A","No rating"
"asperiores ea ipsam voluptatibus modi minima quia sint","N/A","No rating"
"dolor sint quo a velit explicabo quia nam","N/A","No rating"
"maxime id vitae nihil numquam","N/A","No rating"
"autem hic labore sunt dolores incidunt","N/A","No rating"
"rem alias distinctio quo quis","N/A","No rating"
"est et quae odit qui non","N/A","No rating"
"quasi id et eos tenetur aut quo autem","N/A","No rating"
"delectus ullam et corporis nulla voluptas sequi","N/A","No rating"
"iusto eius quod necessitatibus culpa ea","N/A","No rating"
"a quo magni similique perferendis","N/A","No rating"
"ullam ut quidem id aut vel consequuntur","N/A","No rating"
"doloremque illum aliquid sunt","N/A","No rating"
"qui explicabo molestiae dolorem","N/A","No rating"
"magnam ut rerum iure","N/A","No rating"
"id nihil consequatur molestias animi provident","N/A","No rating"
"fuga nam accusamus voluptas reiciendis itaque","N/A","No rating"
"provident vel ut sit ratione est","N/A","No rating"
"explicabo et eos deleniti nostrum ab id repellendus","N/A","No rating"
"eos dolorem iste accusantium est eaque quam","N/A","No rating"
"enim quo cumque","N/A","No rating"
"non est facere","N/A","No rating"
"commodi ullam sint et excepturi error explicabo praesentium voluptas","N/A","No rating"
"eligendi iste nostrum consequuntur adipisci praesentium sit beatae perferendis","N/A","No rating"
"optio dolor molestias sit","N/A","No rating"
"ut numquam possimus omnis eius suscipit laudantium iure","N/A","No rating"
"aut quo modi neque nostrum ducimus","N/A","No rating"
"quibusdam cumque rem aut deserunt","N/A","No rating"
"ut voluptatem illum ea doloribus itaque eos","N/A","No rating"
"laborum non sunt aut ut assumenda perspiciatis voluptas","N/A","No rating"
"repellendus qui recusandae incidunt voluptates tenetur qui omnis exercitationem","N/A","No rating"
"soluta aliquam aperiam consequatur illo quis voluptas","N/A","No rating"
"qui enim et consequuntur quia animi quis voluptate quibusdam","N/A","No rating"
"ut quo aut ducimus alias","N/A","No rating"
"sit asperiores ipsam eveniet odio non quia","N/A","No rating"
"sit vel voluptatem et non libero","N/A","No rating"
"qui et at rerum necessitatibus","N/A","No rating"
"sed ab est est","N/A","No rating"
"voluptatum itaque dolores nisi et quasi","N/A","No rating"
"qui commodi dolor at maiores et quis id accusantium","N/A","No rating"
"consequatur placeat omnis quisquam quia reprehenderit fugit veritatis facere","N/A","No rating"
"voluptatem doloribus consectetur est ut ducimus","N/A","No rating"
"beatae enim quia vel","N/A","No rating"
"voluptas blanditiis repellendus animi ducimus error sapiente et suscipit","N/A","No rating"
"et fugit quas eum in in aperiam quod","N/A","No rating"
"consequatur id enim sunt et et","N/A","No rating"
"repudiandae ea animi iusto","N/A","No rating"
"aliquid eos sed fuga est maxime repellendus","N/A","No rating"
"odio quis facere architecto reiciendis optio","N/A","No rating"
"fugiat quod pariatur odit minima","N/A","No rating"
"voluptatem laborum magni","N/A","No rating"
"et iusto veniam et illum aut fuga","N/A","No rating"
"sint hic doloribus consequatur eos non id","N/A","No rating"
"consequuntur deleniti eos quia temporibus ab aliquid at","N/A","No rating"
"enim unde ratione doloribus quas enim ut sit sapiente","N/A","No rating"
"dignissimos eum dolor ut enim et delectus in","N/A","No rating"
"doloremque officiis ad et non perferendis","N/A","No rating"
"necessitatibus quasi exercitationem odio","N/A","No rating"
"quam voluptatibus rerum veritatis","N/A","No rating"
"pariatur consequatur quia magnam autem omnis non amet","N/A","No rating"
"labore in ex et explicabo corporis aut quas","N/A","No rating"
"tempora rem veritatis voluptas quo dolores vero","N/A","No rating"
"laudantium voluptate suscipit sunt enim enim","N/A","No rating"
"odit et voluptates doloribus alias odio et","N/A","No rating"
"optio ipsam molestias necessitatibus occaecati facilis veritatis dolores aut","N/A","No rating"
"dolore veritatis porro provident adipisci blanditiis et sunt","N/A","No rating"
"placeat quia et porro iste","N/A","No rating"
"nostrum quis quasi placeat","N/A","No rating"
"sapiente omnis fugit eos","N/A","No rating"
"sint soluta et vel magnam aut ut sed qui","N/A","No rating"
"ad iusto omnis odit dolor voluptatibus","N/A","No rating"
"aut amet sed","N/A","No rating"
"ratione ex tenetur perferendis","N/A","No rating"
"beatae soluta recusandae","N/A","No rating"
"qui qui voluptates illo iste minima","N/A","No rating"
"id minus libero illum nam ad officiis","N/A","No rating"
"quaerat velit veniam amet cupiditate aut numquam ut sequi","N/A","No rating"
"quas fugiat ut perspiciatis vero provident","N/A","No rating"
"laboriosam dolor voluptates","N/A","No rating"
"temporibus sit alias delectus eligendi possimus magni","N/A","No rating"
"at nam consequatur ea labore ea harum","N/A","No rating"
